{
  "orderId": "WEB-2026-061",
  "orderType": "standard",
  "source": "web",
  "receivedAt": "2026-10-21T09:00:00Z",
  "orderDate": "2026-10-21T08:58:12Z",
  "customer": {
    "name": "Anna Bērziņa",
    "email": "anna.berzina@example.com",
    "address": { "street": "Brīvības iela 100", "city": "Rīga", "postalCode": "LV-1001", "country": "LV" }
  },
  "items": [
    { "productId": "PROD-001", "productName": "Wireless Mouse", "quantity": 2, "unitPrice": "22.50", "currency": "EUR", "taxRate": 0.21 },
    { "productId": "PROD-008", "productName": "Laptop Sleeve", "quantity": 1, "unitPrice": "18.90", "currency": "EUR", "taxRate": 0.21 }
  ],
  "currency": "EUR",
  "status": "new"
}
